{"$schema":"https://json-schema.org/draft/2020-12/schema","$id":"https://example.invalid/exam-engine/mcq-pack.v2.schema.json","title":"ExamEngine MCQ Pack v2","type":"object","required":["schemaVersion","exam","difficulty","timing","scoring","delivery","questions"],"properties":{"schemaVersion":{"const":"2.0"},"exam":{"type":"object","required":["title","subject","examType","totalMarks"],"properties":{"title":{"type":"string","minLength":1},"subject":{"type":"string","minLength":1},"examType":{"enum":["Quiz","Midterm","Final","Mock Test","Practice","Other"]},"totalMarks":{"type":"number","exclusiveMinimum":0},"instructions":{"type":"string"},"difficultyNote":{"type":"string"}},"additionalProperties":true},"difficulty":{"enum":["easy","moderate","hard","mixed"]},"timing":{"type":"object","required":["mode"],"properties":{"mode":{"enum":["none","exam","question","both"]},"examDurationSeconds":{"type":"integer","minimum":1},"defaultQuestionSeconds":{"type":"integer","minimum":1}},"allOf":[{"if":{"properties":{"mode":{"enum":["exam","both"]}},"required":["mode"]},"then":{"required":["examDurationSeconds"]}},{"if":{"properties":{"mode":{"enum":["question","both"]}},"required":["mode"]},"then":{"required":["defaultQuestionSeconds"]}}],"additionalProperties":false},"scoring":{"type":"object","required":["mode"],"properties":{"mode":{"enum":["question","uniform"]},"correctMarks":{"type":"number","minimum":0},"negativeMarks":{"type":"number","minimum":0}},"allOf":[{"if":{"properties":{"mode":{"const":"uniform"}},"required":["mode"]},"then":{"required":["correctMarks","negativeMarks"]}}],"additionalProperties":false},"delivery":{"type":"object","required":["mode","shuffleQuestions","shuffleOptions"],"properties":{"mode":{"enum":["exam","study"]},"shuffleQuestions":{"type":"boolean"},"shuffleOptions":{"type":"boolean"},"seed":{"type":["string","integer"]}},"additionalProperties":false},"source":{"type":"object","properties":{"book":{"type":"string"},"chapter":{"type":"string"},"paperYear":{"type":"string"}},"additionalProperties":true},"sections":{"type":"array","items":{"type":"object","required":["id","title"],"properties":{"id":{"type":"string","minLength":1},"title":{"type":"string","minLength":1},"instructions":{"type":"string"},"durationSeconds":{"type":"integer","minimum":1}},"additionalProperties":false}},"questions":{"type":"array","minItems":1,"items":{"type":"object","required":["id","question","options","marks","negativeMarks"],"properties":{"id":{"type":"integer","minimum":1},"question":{"type":"string","minLength":1},"options":{"type":"array","minItems":2,"items":{"type":"string","minLength":1},"uniqueItems":true},"answerIndex":{"type":"integer","minimum":0},"multiSelect":{"type":"boolean"},"answerIndices":{"type":"array","minItems":2,"items":{"type":"integer","minimum":0},"uniqueItems":true},"marks":{"type":"number","exclusiveMinimum":0},"negativeMarks":{"type":"number","minimum":0},"questionTimeSeconds":{"type":"integer","minimum":1},"explanation":{"type":"string"},"topic":{"type":"string"},"difficulty":{"enum":["easy","moderate","hard"]},"cognitiveLevel":{"enum":["remember","understand","apply","analyze","evaluate"]},"learningObjective":{"type":"string"},"sourceRefs":{"type":"array","items":{"type":"string","minLength":1},"uniqueItems":true},"tags":{"type":"array","items":{"type":"string","minLength":1},"uniqueItems":true},"confidence":{"type":"number","minimum":0,"maximum":1},"sectionId":{"type":"string"},"questionUid":{"type":"string","minLength":1,"pattern":"\\S"},"sourceBindings":{"type":"array","items":{"type":"object","required":["sourceId"],"properties":{"sourceId":{"type":"string","minLength":1,"pattern":"\\S"},"page":{"type":"integer","minimum":1},"excerpt":{"type":"string"}},"additionalProperties":false}}},"oneOf":[{"required":["answerIndex"],"not":{"required":["answerIndices"]}},{"required":["multiSelect","answerIndices"],"properties":{"multiSelect":{"const":true}},"not":{"required":["answerIndex"]}}],"additionalProperties":true}},"packId":{"type":"string","minLength":1,"pattern":"\\S"}},"additionalProperties":true}
